{
  "id": "2025-09-14-1800-yin3",
  "description": "丙戌 丁酉 阴遁3局 — 2025-09-14 18:00 (IMG_7630). Transcribed from the reference-app screenshot; 中五宫 was not transcribed, so only the 8 outer palaces are asserted.",
  "sources": [
    {
      "name": "时家奇门(转盘) reference app screenshot",
      "retrievedDate": "2025-09-08",
      "notes": "Screenshot IMG_7630.PNG, method label \"[9置闰]\". retrievedDate is the screenshot file date."
    }
  ],
  "verified": {
    "by": "Joe (domain expert) — transcribed in qimen-engine/tests/references*.ts",
    "date": "2025-07-19",
    "crossChecked": false
  },
  "input": {
    "instant": "2025-09-14T18:00:00+08:00",
    "options": {
      "method": "zhirun",
      "boardType": "zhuanpan",
      "lateZiShi": "nextDay",
      "centrePalace": "kun"
    }
  },
  "expected": {
    "pillars": {
      "year": "乙巳",
      "month": "乙酉",
      "day": "丙戌",
      "hour": "丁酉"
    },
    "dun": "yin",
    "ju": 3,
    "xunShou": "甲午",
    "xunShouYi": "辛",
    "zhiFu": {
      "star": "天英",
      "palace": 6
    },
    "zhiShi": {
      "gate": "景门",
      "palace": 6
    },
    "kongWang": {
      "hourVoid": [
        "辰",
        "巳"
      ],
      "dayVoid": [
        "午",
        "未"
      ]
    },
    "palaces": {
      "4": {
        "diPanStems": [
          "乙"
        ],
        "tianPanStems": [
          "庚"
        ],
        "stars": [
          "天蓬"
        ],
        "gate": "休门",
        "spirit": "白虎"
      },
      "9": {
        "diPanStems": [
          "辛"
        ],
        "tianPanStems": [
          "壬"
        ],
        "stars": [
          "天任"
        ],
        "gate": "生门",
        "spirit": "六合"
      },
      "2": {
        "diPanStems": [
          "己"
        ],
        "tianPanStems": [
          "戊"
        ],
        "stars": [
          "天冲"
        ],
        "gate": "伤门",
        "spirit": "太阴"
      },
      "3": {
        "diPanStems": [
          "戊"
        ],
        "tianPanStems": [
          "丁"
        ],
        "stars": [
          "天心"
        ],
        "gate": "开门",
        "spirit": "玄武"
      },
      "7": {
        "diPanStems": [
          "癸"
        ],
        "tianPanStems": [
          "乙"
        ],
        "stars": [
          "天辅"
        ],
        "gate": "杜门",
        "spirit": "腾蛇"
      },
      "8": {
        "diPanStems": [
          "壬"
        ],
        "tianPanStems": [
          "癸"
        ],
        "stars": [
          "天柱"
        ],
        "gate": "惊门",
        "spirit": "九地"
      },
      "1": {
        "diPanStems": [
          "庚"
        ],
        "tianPanStems": [
          "己",
          "丙"
        ],
        "stars": [
          "天芮",
          "天禽"
        ],
        "gate": "死门",
        "spirit": "九天"
      },
      "6": {
        "diPanStems": [
          "丁"
        ],
        "tianPanStems": [
          "辛"
        ],
        "stars": [
          "天英"
        ],
        "gate": "景门",
        "spirit": "值符"
      }
    }
  }
}
