{
  "id": "2024-11-04-1027-yin9",
  "description": "壬申 乙巳 阴遁9局 — 2024-11-04 10:27 (IMG_5147). Transcribed from the reference-app screenshot; 中五宫 was not transcribed, so only the 8 outer palaces are asserted.",
  "sources": [
    {
      "name": "时家奇门(转盘) reference app screenshot",
      "retrievedDate": "2024-10-30",
      "notes": "Screenshot IMG_5147.PNG, method label \"[9置闰]\". retrievedDate is the screenshot file date."
    }
  ],
  "verified": {
    "by": "Joe (domain expert) — transcribed in qimen-engine/tests/references*.ts",
    "date": "2025-07-19",
    "crossChecked": false
  },
  "input": {
    "instant": "2024-11-04T10:27:00+08:00",
    "options": {
      "method": "zhirun",
      "boardType": "zhuanpan",
      "lateZiShi": "nextDay",
      "centrePalace": "kun"
    }
  },
  "expected": {
    "pillars": {
      "year": "甲辰",
      "month": "甲戌",
      "day": "壬申",
      "hour": "乙巳"
    },
    "dun": "yin",
    "ju": 9,
    "xunShou": "甲辰",
    "xunShouYi": "壬",
    "zhiFu": {
      "star": "天禽",
      "palace": 1
    },
    "zhiShi": {
      "gate": "死门",
      "palace": 4
    },
    "kongWang": {
      "hourVoid": [
        "寅",
        "卯"
      ],
      "dayVoid": [
        "戌",
        "亥"
      ]
    },
    "palaces": {
      "4": {
        "diPanStems": [
          "癸"
        ],
        "tianPanStems": [
          "乙"
        ],
        "stars": [
          "天蓬"
        ],
        "gate": "死门",
        "spirit": "玄武"
      },
      "9": {
        "diPanStems": [
          "戊"
        ],
        "tianPanStems": [
          "己"
        ],
        "stars": [
          "天任"
        ],
        "gate": "惊门",
        "spirit": "白虎"
      },
      "2": {
        "diPanStems": [
          "丙"
        ],
        "tianPanStems": [
          "丁"
        ],
        "stars": [
          "天冲"
        ],
        "gate": "开门",
        "spirit": "六合"
      },
      "3": {
        "diPanStems": [
          "丁"
        ],
        "tianPanStems": [
          "辛"
        ],
        "stars": [
          "天心"
        ],
        "gate": "景门",
        "spirit": "九地"
      },
      "7": {
        "diPanStems": [
          "庚"
        ],
        "tianPanStems": [
          "癸"
        ],
        "stars": [
          "天辅"
        ],
        "gate": "休门",
        "spirit": "太阴"
      },
      "8": {
        "diPanStems": [
          "己"
        ],
        "tianPanStems": [
          "庚"
        ],
        "stars": [
          "天柱"
        ],
        "gate": "杜门",
        "spirit": "九天"
      },
      "1": {
        "diPanStems": [
          "乙"
        ],
        "tianPanStems": [
          "丙",
          "壬"
        ],
        "stars": [
          "天芮",
          "天禽"
        ],
        "gate": "伤门",
        "spirit": "值符"
      },
      "6": {
        "diPanStems": [
          "辛"
        ],
        "tianPanStems": [
          "戊"
        ],
        "stars": [
          "天英"
        ],
        "gate": "生门",
        "spirit": "腾蛇"
      }
    }
  }
}
