{
  "id": "2024-09-16-1534-yin9-chaibu",
  "description": "癸未 庚申 阴遁9局 拆补 — 2024-09-16 15:34 (IMG_4647). Transcribed from the reference-app screenshot; 中五宫 was not transcribed, so only the 8 outer palaces are asserted.",
  "sources": [
    {
      "name": "时家奇门(转盘) reference app screenshot",
      "retrievedDate": "2024-09-15",
      "notes": "Screenshot IMG_4647.PNG (Qimen Charts - Chai Bu/), method label \"[拆补]\". The chart instant is the app's red second line (2024-09-16 15:34), not the screenshot time on the first line. retrievedDate is the screenshot file date."
    }
  ],
  "verified": {
    "by": "Claude — transcribed from the screenshot, not yet reviewed by Joe",
    "date": "2026-10-18",
    "crossChecked": false
  },
  "input": {
    "instant": "2024-09-16T15:34:00+08:00",
    "options": {
      "method": "chaibu",
      "boardType": "zhuanpan",
      "lateZiShi": "nextDay",
      "centrePalace": "kun"
    }
  },
  "expected": {
    "pillars": {
      "year": "甲辰",
      "month": "癸酉",
      "day": "癸未",
      "hour": "庚申"
    },
    "dun": "yin",
    "ju": 9,
    "xunShou": "甲寅",
    "xunShouYi": "癸",
    "zhiFu": {
      "star": "天辅",
      "palace": 7
    },
    "zhiShi": {
      "gate": "杜门",
      "palace": 7
    },
    "kongWang": {
      "hourVoid": [
        "子",
        "丑"
      ],
      "dayVoid": [
        "申",
        "酉"
      ]
    },
    "palaces": {
      "4": {
        "diPanStems": [
          "癸"
        ],
        "tianPanStems": [
          "乙"
        ],
        "stars": [
          "天蓬"
        ],
        "gate": "休门",
        "spirit": "六合"
      },
      "9": {
        "diPanStems": [
          "戊"
        ],
        "tianPanStems": [
          "己"
        ],
        "stars": [
          "天任"
        ],
        "gate": "生门",
        "spirit": "太阴"
      },
      "2": {
        "diPanStems": [
          "丙"
        ],
        "tianPanStems": [
          "丁"
        ],
        "stars": [
          "天冲"
        ],
        "gate": "伤门",
        "spirit": "腾蛇"
      },
      "3": {
        "diPanStems": [
          "丁"
        ],
        "tianPanStems": [
          "辛"
        ],
        "stars": [
          "天心"
        ],
        "gate": "开门",
        "spirit": "白虎"
      },
      "7": {
        "diPanStems": [
          "庚"
        ],
        "tianPanStems": [
          "癸"
        ],
        "stars": [
          "天辅"
        ],
        "gate": "杜门",
        "spirit": "值符"
      },
      "8": {
        "diPanStems": [
          "己"
        ],
        "tianPanStems": [
          "庚"
        ],
        "stars": [
          "天柱"
        ],
        "gate": "惊门",
        "spirit": "玄武"
      },
      "1": {
        "diPanStems": [
          "乙"
        ],
        "tianPanStems": [
          "丙",
          "壬"
        ],
        "stars": [
          "天芮",
          "天禽"
        ],
        "gate": "死门",
        "spirit": "九地"
      },
      "6": {
        "diPanStems": [
          "辛"
        ],
        "tianPanStems": [
          "戊"
        ],
        "stars": [
          "天英"
        ],
        "gate": "景门",
        "spirit": "九天"
      }
    }
  }
}
