{
  "id": "2026-01-22-1400-yang3",
  "description": "丙申 乙未 阳遁3局 — 2026-01-22 14:00 (IMG_8579). Transcribed from the reference-app screenshot; 中五宫 was not transcribed, so only the 8 outer palaces are asserted.",
  "sources": [
    {
      "name": "时家奇门(转盘) reference app screenshot",
      "retrievedDate": "2026-01-06",
      "notes": "Screenshot IMG_8579.PNG, method label \"[9置闰]\". retrievedDate is the screenshot file date."
    }
  ],
  "verified": {
    "by": "Joe (domain expert) — transcribed in qimen-engine/tests/references*.ts",
    "date": "2025-07-19",
    "crossChecked": false
  },
  "input": {
    "instant": "2026-01-22T14:00:00+08:00",
    "options": {
      "method": "zhirun",
      "boardType": "zhuanpan",
      "lateZiShi": "nextDay",
      "centrePalace": "kun",
      "spiritVariant": true
    }
  },
  "expected": {
    "pillars": {
      "year": "乙巳",
      "month": "己丑",
      "day": "丙申",
      "hour": "乙未"
    },
    "dun": "yang",
    "ju": 3,
    "xunShou": "甲午",
    "xunShouYi": "辛",
    "zhiFu": {
      "star": "天心",
      "palace": 2
    },
    "zhiShi": {
      "gate": "开门",
      "palace": 7
    },
    "kongWang": {
      "hourVoid": [
        "辰",
        "巳"
      ],
      "dayVoid": [
        "辰",
        "巳"
      ]
    },
    "palaces": {
      "4": {
        "diPanStems": [
          "己"
        ],
        "tianPanStems": [
          "乙",
          "庚"
        ],
        "stars": [
          "天芮",
          "天禽"
        ],
        "gate": "景门",
        "spirit": "九地"
      },
      "9": {
        "diPanStems": [
          "丁"
        ],
        "tianPanStems": [
          "壬"
        ],
        "stars": [
          "天柱"
        ],
        "gate": "死门",
        "spirit": "九天"
      },
      "2": {
        "diPanStems": [
          "乙"
        ],
        "tianPanStems": [
          "辛"
        ],
        "stars": [
          "天心"
        ],
        "gate": "惊门",
        "spirit": "值符"
      },
      "3": {
        "diPanStems": [
          "戊"
        ],
        "tianPanStems": [
          "丁"
        ],
        "stars": [
          "天英"
        ],
        "gate": "杜门",
        "spirit": "朱雀"
      },
      "7": {
        "diPanStems": [
          "壬"
        ],
        "tianPanStems": [
          "丙"
        ],
        "stars": [
          "天蓬"
        ],
        "gate": "开门",
        "spirit": "腾蛇"
      },
      "8": {
        "diPanStems": [
          "癸"
        ],
        "tianPanStems": [
          "己"
        ],
        "stars": [
          "天辅"
        ],
        "gate": "伤门",
        "spirit": "勾陈"
      },
      "1": {
        "diPanStems": [
          "丙"
        ],
        "tianPanStems": [
          "戊"
        ],
        "stars": [
          "天冲"
        ],
        "gate": "生门",
        "spirit": "六合"
      },
      "6": {
        "diPanStems": [
          "辛"
        ],
        "tianPanStems": [
          "癸"
        ],
        "stars": [
          "天任"
        ],
        "gate": "休门",
        "spirit": "太阴"
      }
    }
  }
}
