{
  "id": "2026-03-18-1006-yang4",
  "description": "辛卯 癸巳 阳遁4局 — 2026-03-18 10:06 (IMG_8394). Transcribed from the reference-app screenshot; 中五宫 was not transcribed, so only the 8 outer palaces are asserted.",
  "sources": [
    {
      "name": "时家奇门(转盘) reference app screenshot",
      "retrievedDate": "2025-12-21",
      "notes": "Screenshot IMG_8394.PNG, method label \"[9置闰]\". retrievedDate is the screenshot file date."
    }
  ],
  "verified": {
    "by": "Joe (domain expert) — transcribed in qimen-engine/tests/references*.ts",
    "date": "2025-07-19",
    "crossChecked": false
  },
  "input": {
    "instant": "2026-03-18T10:06:00+08:00",
    "options": {
      "method": "zhirun",
      "boardType": "zhuanpan",
      "lateZiShi": "nextDay",
      "centrePalace": "kun"
    }
  },
  "expected": {
    "pillars": {
      "year": "丙午",
      "month": "辛卯",
      "day": "辛卯",
      "hour": "癸巳"
    },
    "dun": "yang",
    "ju": 4,
    "xunShou": "甲申",
    "xunShouYi": "庚",
    "zhiFu": {
      "star": "天心",
      "palace": 9
    },
    "zhiShi": {
      "gate": "开门",
      "palace": 6
    },
    "kongWang": {
      "hourVoid": [
        "午",
        "未"
      ],
      "dayVoid": [
        "午",
        "未"
      ]
    },
    "palaces": {
      "4": {
        "diPanStems": [
          "戊"
        ],
        "tianPanStems": [
          "辛"
        ],
        "stars": [
          "天柱"
        ],
        "gate": "杜门",
        "spirit": "九天"
      },
      "9": {
        "diPanStems": [
          "癸"
        ],
        "tianPanStems": [
          "庚"
        ],
        "stars": [
          "天心"
        ],
        "gate": "景门",
        "spirit": "值符"
      },
      "2": {
        "diPanStems": [
          "丙"
        ],
        "tianPanStems": [
          "丁"
        ],
        "stars": [
          "天蓬"
        ],
        "gate": "死门",
        "spirit": "腾蛇"
      },
      "3": {
        "diPanStems": [
          "乙"
        ],
        "tianPanStems": [
          "丙",
          "己"
        ],
        "stars": [
          "天芮",
          "天禽"
        ],
        "gate": "伤门",
        "spirit": "九地"
      },
      "7": {
        "diPanStems": [
          "辛"
        ],
        "tianPanStems": [
          "壬"
        ],
        "stars": [
          "天任"
        ],
        "gate": "惊门",
        "spirit": "太阴"
      },
      "8": {
        "diPanStems": [
          "壬"
        ],
        "tianPanStems": [
          "癸"
        ],
        "stars": [
          "天英"
        ],
        "gate": "生门",
        "spirit": "玄武"
      },
      "1": {
        "diPanStems": [
          "丁"
        ],
        "tianPanStems": [
          "戊"
        ],
        "stars": [
          "天辅"
        ],
        "gate": "休门",
        "spirit": "白虎"
      },
      "6": {
        "diPanStems": [
          "庚"
        ],
        "tianPanStems": [
          "乙"
        ],
        "stars": [
          "天冲"
        ],
        "gate": "开门",
        "spirit": "六合"
      }
    }
  }
}
