{
  "id": "2025-09-07-1600-yin9",
  "description": "己卯 壬申 阴遁9局 — 2025-09-07 16:00 (IMG_7530). 白露日 16:00, 精确交节 16:51 前. Transcribed from the reference-app screenshot; 中五宫 was not transcribed, so only the 8 outer palaces are asserted. ⚠ DIVERGES FROM THE SCREENSHOT, DELIBERATELY. 白露 crosses at 16:51, after this 16:00 instant, so the classical rule (§4.3 Bug 1) puts this in 甲申 — the app displays 乙酉. The app is NOT self-consistent about this: fixture 2025-02-03-1232-yang9 (IMG_5811) is the same situation — 立春 crossing at 22:10, chart at 12:32 — and there the app correctly does NOT switch (年月未换, month 丁丑). Same case, opposite behaviour, so there is no consistent app rule to follow and this is treated as an app quirk. Every other field is as displayed.",
  "sources": [
    {
      "name": "时家奇门(转盘) reference app screenshot",
      "retrievedDate": "2025-08-27",
      "notes": "Screenshot IMG_7530.PNG, method label \"[9置闰]\". retrievedDate is the screenshot file date. Case: 白露日 16:00, 精确交节 16:51 前. Month pillar intentionally differs from the screenshot — see the description; all other fields are as displayed."
    }
  ],
  "verified": {
    "by": "Joe (domain expert) — transcribed in qimen-engine/tests/references*.ts",
    "date": "2025-07-19",
    "crossChecked": false
  },
  "input": {
    "instant": "2025-09-07T16:00:00+08:00",
    "options": {
      "method": "zhirun",
      "boardType": "zhuanpan",
      "lateZiShi": "nextDay",
      "centrePalace": "kun"
    }
  },
  "expected": {
    "pillars": {
      "year": "乙巳",
      "month": "甲申",
      "day": "己卯",
      "hour": "壬申"
    },
    "dun": "yin",
    "ju": 9,
    "xunShou": "甲子",
    "xunShouYi": "戊",
    "zhiFu": {
      "star": "天英",
      "palace": 5
    },
    "zhiShi": {
      "gate": "景门",
      "palace": 1
    },
    "kongWang": {
      "hourVoid": [
        "戌",
        "亥"
      ],
      "dayVoid": [
        "申",
        "酉"
      ]
    },
    "palaces": {
      "4": {
        "diPanStems": [
          "癸"
        ],
        "tianPanStems": [
          "丁"
        ],
        "stars": [
          "天冲"
        ],
        "gate": "开门",
        "spirit": "太阴"
      },
      "9": {
        "diPanStems": [
          "戊"
        ],
        "tianPanStems": [
          "癸"
        ],
        "stars": [
          "天辅"
        ],
        "gate": "休门",
        "spirit": "腾蛇"
      },
      "2": {
        "diPanStems": [
          "丙"
        ],
        "tianPanStems": [
          "戊"
        ],
        "stars": [
          "天英"
        ],
        "gate": "生门",
        "spirit": "值符"
      },
      "3": {
        "diPanStems": [
          "丁"
        ],
        "tianPanStems": [
          "己"
        ],
        "stars": [
          "天任"
        ],
        "gate": "惊门",
        "spirit": "六合"
      },
      "7": {
        "diPanStems": [
          "庚"
        ],
        "tianPanStems": [
          "丙",
          "壬"
        ],
        "stars": [
          "天芮",
          "天禽"
        ],
        "gate": "伤门",
        "spirit": "九天"
      },
      "8": {
        "diPanStems": [
          "己"
        ],
        "tianPanStems": [
          "乙"
        ],
        "stars": [
          "天蓬"
        ],
        "gate": "死门",
        "spirit": "白虎"
      },
      "1": {
        "diPanStems": [
          "乙"
        ],
        "tianPanStems": [
          "辛"
        ],
        "stars": [
          "天心"
        ],
        "gate": "景门",
        "spirit": "玄武"
      },
      "6": {
        "diPanStems": [
          "辛"
        ],
        "tianPanStems": [
          "庚"
        ],
        "stars": [
          "天柱"
        ],
        "gate": "杜门",
        "spirit": "九地"
      }
    }
  }
}
