{
  "id": "2025-09-03-0800-yin7",
  "description": "乙亥 庚辰 阴遁7局 — 2025-09-03 08:00 (IMG_7532). Transcribed from the reference-app screenshot; 中五宫 was not transcribed, so only the 8 outer palaces are asserted.",
  "sources": [
    {
      "name": "时家奇门(转盘) reference app screenshot",
      "retrievedDate": "2025-08-27",
      "notes": "Screenshot IMG_7532.PNG, method label \"[9置闰]\". retrievedDate is the screenshot file date."
    }
  ],
  "verified": {
    "by": "Joe (domain expert) — transcribed in qimen-engine/tests/references*.ts",
    "date": "2025-07-19",
    "crossChecked": false
  },
  "input": {
    "instant": "2025-09-03T08:00:00+08:00",
    "options": {
      "method": "zhirun",
      "boardType": "zhuanpan",
      "lateZiShi": "nextDay",
      "centrePalace": "kun"
    }
  },
  "expected": {
    "pillars": {
      "year": "乙巳",
      "month": "甲申",
      "day": "乙亥",
      "hour": "庚辰"
    },
    "dun": "yin",
    "ju": 7,
    "xunShou": "甲戌",
    "xunShouYi": "己",
    "zhiFu": {
      "star": "天心",
      "palace": 5
    },
    "zhiShi": {
      "gate": "开门",
      "palace": 9
    },
    "kongWang": {
      "hourVoid": [
        "申",
        "酉"
      ],
      "dayVoid": [
        "申",
        "酉"
      ]
    },
    "palaces": {
      "4": {
        "diPanStems": [
          "辛"
        ],
        "tianPanStems": [
          "癸",
          "庚"
        ],
        "stars": [
          "天芮",
          "天禽"
        ],
        "gate": "惊门",
        "spirit": "太阴"
      },
      "9": {
        "diPanStems": [
          "丙"
        ],
        "tianPanStems": [
          "戊"
        ],
        "stars": [
          "天柱"
        ],
        "gate": "开门",
        "spirit": "腾蛇"
      },
      "2": {
        "diPanStems": [
          "癸"
        ],
        "tianPanStems": [
          "己"
        ],
        "stars": [
          "天心"
        ],
        "gate": "休门",
        "spirit": "值符"
      },
      "3": {
        "diPanStems": [
          "壬"
        ],
        "tianPanStems": [
          "丙"
        ],
        "stars": [
          "天英"
        ],
        "gate": "死门",
        "spirit": "六合"
      },
      "7": {
        "diPanStems": [
          "戊"
        ],
        "tianPanStems": [
          "丁"
        ],
        "stars": [
          "天蓬"
        ],
        "gate": "生门",
        "spirit": "九天"
      },
      "8": {
        "diPanStems": [
          "乙"
        ],
        "tianPanStems": [
          "辛"
        ],
        "stars": [
          "天辅"
        ],
        "gate": "景门",
        "spirit": "白虎"
      },
      "1": {
        "diPanStems": [
          "丁"
        ],
        "tianPanStems": [
          "壬"
        ],
        "stars": [
          "天冲"
        ],
        "gate": "杜门",
        "spirit": "玄武"
      },
      "6": {
        "diPanStems": [
          "己"
        ],
        "tianPanStems": [
          "乙"
        ],
        "stars": [
          "天任"
        ],
        "gate": "伤门",
        "spirit": "九地"
      }
    }
  }
}
