{
  "id": "2025-12-25-1246-yang1",
  "description": "戊辰 戊午 阳遁1局 — 2025-12-25 12:46 (IMG_8415). Transcribed from the reference-app screenshot; 中五宫 was not transcribed, so only the 8 outer palaces are asserted.",
  "sources": [
    {
      "name": "时家奇门(转盘) reference app screenshot",
      "retrievedDate": "2025-12-25",
      "notes": "Screenshot IMG_8415.PNG, method label \"[9置闰]\". retrievedDate is the screenshot file date."
    }
  ],
  "verified": {
    "by": "Joe (domain expert) — transcribed in qimen-engine/tests/references*.ts",
    "date": "2025-07-19",
    "crossChecked": false
  },
  "input": {
    "instant": "2025-12-25T12:46:00+08:00",
    "options": {
      "method": "zhirun",
      "boardType": "zhuanpan",
      "lateZiShi": "nextDay",
      "centrePalace": "kun"
    }
  },
  "expected": {
    "pillars": {
      "year": "乙巳",
      "month": "戊子",
      "day": "戊辰",
      "hour": "戊午"
    },
    "dun": "yang",
    "ju": 1,
    "xunShou": "甲寅",
    "xunShouYi": "癸",
    "zhiFu": {
      "star": "天心",
      "palace": 1
    },
    "zhiShi": {
      "gate": "开门",
      "palace": 1
    },
    "kongWang": {
      "hourVoid": [
        "子",
        "丑"
      ],
      "dayVoid": [
        "戌",
        "亥"
      ]
    },
    "palaces": {
      "4": {
        "diPanStems": [
          "辛"
        ],
        "tianPanStems": [
          "庚"
        ],
        "stars": [
          "天冲"
        ],
        "gate": "伤门",
        "spirit": "六合"
      },
      "9": {
        "diPanStems": [
          "乙"
        ],
        "tianPanStems": [
          "辛"
        ],
        "stars": [
          "天辅"
        ],
        "gate": "杜门",
        "spirit": "白虎"
      },
      "2": {
        "diPanStems": [
          "己"
        ],
        "tianPanStems": [
          "乙"
        ],
        "stars": [
          "天英"
        ],
        "gate": "景门",
        "spirit": "玄武"
      },
      "3": {
        "diPanStems": [
          "庚"
        ],
        "tianPanStems": [
          "丙"
        ],
        "stars": [
          "天任"
        ],
        "gate": "生门",
        "spirit": "太阴"
      },
      "7": {
        "diPanStems": [
          "丁"
        ],
        "tianPanStems": [
          "己",
          "壬"
        ],
        "stars": [
          "天芮",
          "天禽"
        ],
        "gate": "死门",
        "spirit": "九地"
      },
      "8": {
        "diPanStems": [
          "丙"
        ],
        "tianPanStems": [
          "戊"
        ],
        "stars": [
          "天蓬"
        ],
        "gate": "休门",
        "spirit": "腾蛇"
      },
      "1": {
        "diPanStems": [
          "戊"
        ],
        "tianPanStems": [
          "癸"
        ],
        "stars": [
          "天心"
        ],
        "gate": "开门",
        "spirit": "值符"
      },
      "6": {
        "diPanStems": [
          "癸"
        ],
        "tianPanStems": [
          "丁"
        ],
        "stars": [
          "天柱"
        ],
        "gate": "惊门",
        "spirit": "九天"
      }
    }
  }
}
