{
  "id": "2025-06-02-2124-yang2",
  "description": "壬寅 辛亥 阳遁2局 — 2025-06-02 21:24 (IMG_7045). Transcribed from the reference-app screenshot; 中五宫 was not transcribed, so only the 8 outer palaces are asserted.",
  "sources": [
    {
      "name": "时家奇门(转盘) reference app screenshot",
      "retrievedDate": "2025-06-02",
      "notes": "Screenshot IMG_7045.PNG, method label \"[9置闰]\". retrievedDate is the screenshot file date."
    }
  ],
  "verified": {
    "by": "Joe (domain expert) — transcribed in qimen-engine/tests/references*.ts",
    "date": "2025-07-19",
    "crossChecked": false
  },
  "input": {
    "instant": "2025-06-02T21:24:00+08:00",
    "options": {
      "method": "zhirun",
      "boardType": "zhuanpan",
      "lateZiShi": "nextDay",
      "centrePalace": "kun"
    }
  },
  "expected": {
    "pillars": {
      "year": "乙巳",
      "month": "辛巳",
      "day": "壬寅",
      "hour": "辛亥"
    },
    "dun": "yang",
    "ju": 2,
    "xunShou": "甲辰",
    "xunShouYi": "壬",
    "zhiFu": {
      "star": "天心",
      "palace": 5
    },
    "zhiShi": {
      "gate": "开门",
      "palace": 4
    },
    "kongWang": {
      "hourVoid": [
        "寅",
        "卯"
      ],
      "dayVoid": [
        "辰",
        "巳"
      ]
    },
    "palaces": {
      "4": {
        "diPanStems": [
          "庚"
        ],
        "tianPanStems": [
          "戊",
          "辛"
        ],
        "stars": [
          "天芮",
          "天禽"
        ],
        "gate": "开门",
        "spirit": "九地"
      },
      "9": {
        "diPanStems": [
          "丙"
        ],
        "tianPanStems": [
          "癸"
        ],
        "stars": [
          "天柱"
        ],
        "gate": "休门",
        "spirit": "九天"
      },
      "2": {
        "diPanStems": [
          "戊"
        ],
        "tianPanStems": [
          "壬"
        ],
        "stars": [
          "天心"
        ],
        "gate": "生门",
        "spirit": "值符"
      },
      "3": {
        "diPanStems": [
          "己"
        ],
        "tianPanStems": [
          "丙"
        ],
        "stars": [
          "天英"
        ],
        "gate": "惊门",
        "spirit": "玄武"
      },
      "7": {
        "diPanStems": [
          "癸"
        ],
        "tianPanStems": [
          "乙"
        ],
        "stars": [
          "天蓬"
        ],
        "gate": "伤门",
        "spirit": "腾蛇"
      },
      "8": {
        "diPanStems": [
          "丁"
        ],
        "tianPanStems": [
          "庚"
        ],
        "stars": [
          "天辅"
        ],
        "gate": "死门",
        "spirit": "白虎"
      },
      "1": {
        "diPanStems": [
          "乙"
        ],
        "tianPanStems": [
          "己"
        ],
        "stars": [
          "天冲"
        ],
        "gate": "景门",
        "spirit": "六合"
      },
      "6": {
        "diPanStems": [
          "壬"
        ],
        "tianPanStems": [
          "丁"
        ],
        "stars": [
          "天任"
        ],
        "gate": "杜门",
        "spirit": "太阴"
      }
    }
  }
}
